{
  "$schema": "./schema.json",
  "format": "awl",
  "version": "1.0.0",
  "name": "agent.default",
  "description": "Evidence-based default agent workflow: cheap parallel read-only exploration -> frontier planning -> delegation-aware implementation (single writer) -> clean-context diff review -> deterministic verification -> bounded fix/replan loop -> report with telemetry.",
  "meta": {
    "schemaVersion": "2026.09",
    "source": "Cognition 'Multi-Agents: What's Actually Working'; Cognition Devin Fusion; Cognition 'Making Fable Cheaper Than Opus'; Anthropic multi-agent research system; LangChain read-vs-write parallelization; Co-Coder communication/compute tradeoff; OpenTelemetry GenAI semantic conventions.",
    "estimate": {
      "pricesFrom": "usdPerMillionInput/usdPerMillionOutput",
      "perState": "expectedTokens",
      "budgetUsd": 5.0,
      "refit": true
    }
  },
  "models": {
    "frontier": { "provider": "<provider>", "model": "<frontier-model>", "usdPerMillionInput": 5.0, "usdPerMillionOutput": 25.0, "role": "planning, design, ambiguity, final judgement" },
    "cheap":   { "provider": "<provider>", "model": "<cheap-model>",   "usdPerMillionInput": 0.25, "usdPerMillionOutput": 2.0, "role": "mechanical edits, exploration, boilerplate" },
    "review":  { "provider": "<provider>", "model": "<different-family-model>", "usdPerMillionInput": 3.0, "usdPerMillionOutput": 15.0, "role": "clean-context diff review; cross-vendor blind-spot coverage" }
  },
  "agents": {
    "explorer": { "model": "cheap", "readOnly": true, "cleanContext": true, "tools": ["read", "grep", "glob"], "prompt": "Read the target repo scope, map relevant code and docs, and return file paths + snippets. Do not modify anything." },
    "planner":  { "model": "frontier", "cleanContext": true, "prompt": "Write a spec-quality brief: goal, constraints, edge cases, definition of done, and a decision on delegability. Never dictate full file contents - state outcomes and constraints." },
    "writer":   { "model": "frontier", "prompt": "Implement per the spec. Single writer: make all edits yourself, in a coherent thread.", "sidekicks": ["sidekick"] },
    "sidekick": { "model": "cheap", "optional": true, "prompt": "Apply the spec exactly. The plan is fixed: do not design, just implement and run the verification the main agent specified." },
    "reviewer": { "model": "review", "readOnly": true, "cleanContext": true, "tools": ["read", "grep", "glob", "git"], "prompt": "You are a clean-context reviewer. You did not write this code. Review the diff only, then re-discover context. Flag bugs, blind spots, spec non-compliance with severity and file:line." }
  },
  "telemetry": {
    "conventions": "opentelemetry-genai",
    "operationName": "chat",
    "record": [
      "gen_ai.usage.input_tokens",
      "gen_ai.usage.output_tokens",
      "gen_ai.usage.cache_read.input_tokens",
      "gen_ai.provider.name",
      "gen_ai.request.model",
      "durationMs",
      "attempts",
      "loops",
      "outcome",
      "costUsd"
    ],
    "rating": {
      "scale": [1, 2, 3, 4, 5],
      "labels": ["complete", "needs_revision", "blocked", "cancelled"]
    }
  },
  "subflows": {
    "explore_repo": {
      "description": "One read-only cheap exploration pass over a repo scope. Perfectly parallelizable: reads only, no writes, isolated context.",
      "start": "scan",
      "states": {
        "scan": {
          "type": "task",
          "kind": "llm",
          "agent": "explorer",
          "label": "Scan",
          "metrics": { "emit": true },
          "expectedTokens": { "input": 4000, "output": 1500 },
          "end": true
        }
      }
    },
    "fix_attempt": {
      "description": "A bounded corrective pass: writer responds to review + verification feedback, then re-verifies.",
      "start": "apply",
      "states": {
        "apply": {
          "type": "task",
          "kind": "llm",
          "agent": "writer",
          "label": "Apply fixes",
          "context": { "input": "reviewFeedback+verifyOutput" },
          "metrics": { "emit": true },
          "expectedTokens": { "input": 6000, "output": 2500 },
          "next": "reverify"
        },
        "reverify": {
          "type": "task",
          "kind": "tool",
          "label": "Re-verify",
          "run": { "command": "lint && test && typecheck" },
          "metrics": { "emit": true },
          "end": true
        }
      }
    }
  },
  "start": "explore",
  "states": {
    "explore": {
      "type": "parallel",
      "label": "Explore sub-repos (cheap, read-only, parallel)",
      "description": "Fan out one cheap read-only agent per scope. Research: reads parallelize cleanly; context isolation keeps the frontier context lean.",
      "completion": "all",
      "branches": [
        { "label": "api/",            "flow": "explore_repo", "args": { "scope": "api/", "search": "routes/, store/prisma/, lib/" } },
        { "label": "ui/",             "flow": "explore_repo", "args": { "scope": "ui/", "search": "src/Components/, src/SubModules/treks-ui-models/" } },
        { "label": "marketing-site/", "flow": "explore_repo", "args": { "scope": "marketing-site/", "search": "src/app/, zenstack/schema.zmodel" } },
        { "label": "swift-app/",      "flow": "explore_repo", "args": { "scope": "swift-app/", "search": "Models/, Views/" } }
      ],
      "metrics": { "emit": true },
      "next": "plan"
    },
    "plan": {
      "type": "task",
      "kind": "llm",
      "agent": "planner",
      "label": "Plan (frontier, single writer)",
      "description": "Frontier model owns the judgment. Produces a spec artifact - outcome constraints, not dictated code.",
      "context": { "input": "exploreSummaries+task" },
      "artifact": { "kind": "spec", "path": "artifacts/spec.md", "required": true },
      "expectedTokens": { "input": 9000, "output": 3500 },
      "metrics": { "emit": true },
      "evidence": [
        { "source": "Devin Fusion", "finding": "Frontier intelligence should be spent on the plan, ambiguity, and final review - not on mechanical volume." },
        { "source": "Making Fable Cheaper Than Opus", "finding": "The quality lever is the brief: enumerate constraints, edge cases, and a definition of done. Fable's constraint-rich briefs beat Opus's dictated file contents." },
        { "source": "VS Code context-engineering guide", "finding": "An implementation plan is a first-class artifact you can read, diff, and gate before any side effect fires." }
      ],
      "next": "implement"
    },
    "implement": {
      "type": "task",
      "kind": "llm",
      "label": "Implement (delegation-aware, single writer)",
      "description": "A research-grounded decision (LLM or Jev decider) picks the writer: mechanical+safe -> cheap sidekick; judgment-bound -> frontier writer. Exactly one writer runs either way.",
      "agents": {
        "mode": "pick-one",
        "pick": "first",
        "decision": {
          "decider": { "engine": "llm", "agent": "planner" },
          "context": {
            "research": [
              "Devin Fusion: delegation controls what work stays with the expensive model; routing decides whether the expensive model is involved at all.",
              "Making Fable Cheaper Than Opus: forcing delegation decreases performance - it just delegates the wrong things; delegability is itself a judgment call.",
              "Devin Fusion bad example: when the judgment IS the deliverable, delegating it backfires (hard React feature scored 27/100).",
              "Frontier-planner cheap-executor consensus: once the plan is fixed, throughput and cost matter more than raw IQ."
            ],
            "guidelines": [
              "Single writer always: never run two writers in parallel.",
              "Frontier intelligence goes to judgment; volume goes to the cheap tier.",
              "When unsure, prefer the frontier writer over the sidekick."
            ],
            "input": "$.plan"
          },
          "questions": {
            "delegability": {
              "type": "choice",
              "instructions": "Given the plan and the research/guidelines above, is this implementation mechanical enough to hand to the cheap sidekick, or does it still carry judgment that needs the frontier writer?",
              "criteria": {
                "mechanical": "Spec is fixed, edits are safe and local, no design decisions remain.",
                "judgment": "Ambiguity, design, or serial-debugging remains; the deliverable is partly the judgment itself."
              }
            }
          }
        },
        "candidates": [
          { "agent": "sidekick", "optional": true, "when": { "question": "delegability", "equals": "mechanical", "minConfidence": 0.8 } },
          { "agent": "writer" }
        ]
      },
      "retry": { "maxAttempts": 3, "backoffMs": 2000 },
      "expectedTokens": { "input": 14000, "output": 7000 },
      "metrics": { "emit": true },
      "evidence": [
        { "source": "Devin Fusion", "finding": "Delegation controls what work stays with the expensive model; routing decides whether the expensive model is involved at all." },
        { "source": "Making Fable Cheaper Than Opus", "finding": "Forcing delegation decreases performance - it just delegates the wrong things. Delegability is itself a judgment call." },
        { "source": "Devin Fusion bad example", "finding": "When the judgment IS the deliverable, delegating it backfires (hard React feature scored 27/100). Mechanical work hands off cleanly." },
        { "source": "Frontier-planner cheap-executor consensus", "finding": "Once the plan is fixed, throughput and cost matter more than raw IQ." },
        { "source": "LangChain / Cognition", "finding": "Writes must stay single-threaded; parallel writes fragment implicit decisions." }
      ],
      "next": "review"
    },
    "review": {
      "type": "task",
      "kind": "llm",